{
  "recipe_id": "netflix",
  "category": "entertainment",
  "orders": {
    "native": {
      "windows": {
        "manager": "winget",
        "steps": [
          "winget install -e --id 9WZDNCRFJ3NQ"
        ],
        "verify": "get-appxpackage netflix"
      }
    },
    "pwa": {
      "url": "https://netflix.com"
    }
  },
  "availability": {
    "linux": [
      "pwa"
    ],
    "windows": [
      "native",
      "pwa"
    ],
    "macos": [
      "pwa"
    ],
    "android": [
      "pwa"
    ]
  }
}
